{
  "schemaVersion": "xuunity.reference-watch.comparison-report.v1",
  "focus": "build_profiles",
  "generatedAtUtc": "2026-05-23T00:00:00Z",
  "xuunityToolId": "xuunity_light_unity_mcp",
  "xuunityCurrentState": "XUUnity has repo-verified compile validation, active-target-free compile matrix support, build-config compile matrix support, and an EditMode validation lane; broad build execution is not a base goal.",
  "inputs": [
    {
      "toolId": "xuunity_light_unity_mcp",
      "displayName": "XUUnity Light Unity MCP",
      "capturedAtUtc": "2026-05-22T00:00:00Z",
      "captureMethod": "repo_verified"
    },
    {
      "toolId": "unity_mcp_coplay",
      "displayName": "CoplayDev/unity-mcp",
      "capturedAtUtc": "2026-05-23T00:00:00Z",
      "captureMethod": "manual_review"
    },
    {
      "toolId": "unity_mcp_ivanmurzak",
      "displayName": "IvanMurzak/Unity-MCP",
      "capturedAtUtc": "2026-05-23T00:00:00Z",
      "captureMethod": "manual_review"
    },
    {
      "toolId": "mcp_unity_codergamester",
      "displayName": "CoderGamester/mcp-unity",
      "capturedAtUtc": "2026-05-23T00:00:00Z",
      "captureMethod": "manual_review"
    }
  ],
  "overallLeaders": [
    "unity_mcp_coplay",
    "unity_mcp_ivanmurzak"
  ],
  "capabilityLeaders": [
    {
      "capability": "develop_test_loop",
      "sources": [
        "unity_mcp_ivanmurzak"
      ],
      "status": "confirmed",
      "notes": "Generated from normalized feature-bag evidence."
    },
    {
      "capability": "test_run_tools",
      "sources": [
        "unity_mcp_coplay",
        "mcp_unity_codergamester"
      ],
      "status": "confirmed",
      "notes": "Generated from normalized feature-bag evidence."
    }
  ],
  "comparedTools": [
    "xuunity_light_unity_mcp",
    "unity_mcp_coplay",
    "unity_mcp_ivanmurzak",
    "mcp_unity_codergamester"
  ],
  "capabilityMatrix": [
    {
      "capability": "build_config_compile_matrix",
      "focus": "build_profiles",
      "xuunityStatus": "implemented",
      "referenceStatuses": [
        {
          "toolId": "unity_mcp_coplay",
          "status": "missing",
          "confidence": "unknown",
          "evidenceType": "public_source_unknown",
          "notes": "Capability is absent from this normalized bag."
        },
        {
          "toolId": "unity_mcp_ivanmurzak",
          "status": "missing",
          "confidence": "unknown",
          "evidenceType": "public_source_unknown",
          "notes": "Capability is absent from this normalized bag."
        },
        {
          "toolId": "mcp_unity_codergamester",
          "status": "missing",
          "confidence": "unknown",
          "evidenceType": "public_source_unknown",
          "notes": "Capability is absent from this normalized bag."
        }
      ],
      "strongestReferences": [],
      "outcome": "xuunity_ahead",
      "notes": ""
    },
    {
      "capability": "build_tool_surface",
      "focus": "build_profiles",
      "xuunityStatus": "not_a_base_goal",
      "referenceStatuses": [
        {
          "toolId": "unity_mcp_coplay",
          "status": "implemented",
          "confidence": "high",
          "evidenceType": "code_registry",
          "notes": "manage_build is implemented, but active-target-free compile matrix semantics remain unconfirmed.",
          "directAnalog": false,
          "analogTarget": "build_profiles",
          "analogNotes": "manage_build is implemented, but not direct proof of XUUnity compile matrix semantics."
        },
        {
          "toolId": "unity_mcp_ivanmurzak",
          "status": "missing",
          "confidence": "unknown",
          "evidenceType": "public_source_unknown",
          "notes": "Capability is absent from this normalized bag."
        },
        {
          "toolId": "mcp_unity_codergamester",
          "status": "missing",
          "confidence": "unknown",
          "evidenceType": "public_source_unknown",
          "notes": "Capability is absent from this normalized bag."
        }
      ],
      "strongestReferences": [],
      "outcome": "manual_review_required",
      "notes": ""
    },
    {
      "capability": "compile_matrix_without_active_switch",
      "focus": "build_profiles",
      "xuunityStatus": "implemented",
      "referenceStatuses": [
        {
          "toolId": "unity_mcp_coplay",
          "status": "unknown",
          "confidence": "unknown",
          "evidenceType": "public_source_unknown",
          "notes": "No clear public claim in reviewed sources.",
          "directAnalog": false,
          "analogTarget": "compile_matrix_without_active_switch",
          "analogNotes": "No direct analog found."
        },
        {
          "toolId": "unity_mcp_ivanmurzak",
          "status": "unknown",
          "confidence": "unknown",
          "evidenceType": "public_source_unknown",
          "notes": "No clear public claim in reviewed sources.",
          "directAnalog": false,
          "analogTarget": "compile_matrix_without_active_switch",
          "analogNotes": "No direct analog found."
        },
        {
          "toolId": "mcp_unity_codergamester",
          "status": "unknown",
          "confidence": "unknown",
          "evidenceType": "public_source_unknown",
          "notes": "Active-target-free compile matrix validation was not clearly documented.",
          "directAnalog": false,
          "analogTarget": "compile_matrix_without_active_switch",
          "analogNotes": "No direct analog found."
        }
      ],
      "strongestReferences": [],
      "outcome": "xuunity_ahead",
      "notes": ""
    },
    {
      "capability": "compile_validation",
      "focus": "build_profiles",
      "xuunityStatus": "implemented",
      "referenceStatuses": [
        {
          "toolId": "unity_mcp_coplay",
          "status": "missing",
          "confidence": "unknown",
          "evidenceType": "public_source_unknown",
          "notes": "Capability is absent from this normalized bag."
        },
        {
          "toolId": "unity_mcp_ivanmurzak",
          "status": "missing",
          "confidence": "unknown",
          "evidenceType": "public_source_unknown",
          "notes": "Capability is absent from this normalized bag."
        },
        {
          "toolId": "mcp_unity_codergamester",
          "status": "missing",
          "confidence": "unknown",
          "evidenceType": "public_source_unknown",
          "notes": "Capability is absent from this normalized bag."
        }
      ],
      "strongestReferences": [],
      "outcome": "xuunity_ahead",
      "notes": ""
    },
    {
      "capability": "develop_test_loop",
      "focus": "build_profiles",
      "xuunityStatus": "implemented",
      "referenceStatuses": [
        {
          "toolId": "unity_mcp_coplay",
          "status": "missing",
          "confidence": "unknown",
          "evidenceType": "public_source_unknown",
          "notes": "Capability is absent from this normalized bag."
        },
        {
          "toolId": "unity_mcp_ivanmurzak",
          "status": "implemented",
          "confidence": "high",
          "evidenceType": "code_registry",
          "notes": "Test execution and editor play/pause state tools are implemented; active-target-free compile matrix support remains unconfirmed.",
          "directAnalog": true,
          "analogTarget": "develop_test_loop",
          "analogNotes": "Implemented test/editor-state surfaces are a direct reference for validation-loop comparison, with broader scope caveats."
        },
        {
          "toolId": "mcp_unity_codergamester",
          "status": "missing",
          "confidence": "unknown",
          "evidenceType": "public_source_unknown",
          "notes": "Capability is absent from this normalized bag."
        }
      ],
      "strongestReferences": [
        "unity_mcp_ivanmurzak"
      ],
      "outcome": "no_gap",
      "notes": ""
    },
    {
      "capability": "editmode_test_execution",
      "focus": "build_profiles",
      "xuunityStatus": "implemented",
      "referenceStatuses": [
        {
          "toolId": "unity_mcp_coplay",
          "status": "missing",
          "confidence": "unknown",
          "evidenceType": "public_source_unknown",
          "notes": "Capability is absent from this normalized bag."
        },
        {
          "toolId": "unity_mcp_ivanmurzak",
          "status": "missing",
          "confidence": "unknown",
          "evidenceType": "public_source_unknown",
          "notes": "Capability is absent from this normalized bag."
        },
        {
          "toolId": "mcp_unity_codergamester",
          "status": "missing",
          "confidence": "unknown",
          "evidenceType": "public_source_unknown",
          "notes": "Capability is absent from this normalized bag."
        }
      ],
      "strongestReferences": [],
      "outcome": "xuunity_ahead",
      "notes": ""
    },
    {
      "capability": "test_run_tools",
      "focus": "build_profiles",
      "xuunityStatus": "implemented",
      "referenceStatuses": [
        {
          "toolId": "unity_mcp_coplay",
          "status": "implemented",
          "confidence": "high",
          "evidenceType": "code_registry",
          "notes": "run_tests is implemented as a registered tool surface.",
          "directAnalog": true,
          "analogTarget": "test_run_tools",
          "analogNotes": "run_tests is a direct test execution surface, though not benchmarked locally."
        },
        {
          "toolId": "unity_mcp_ivanmurzak",
          "status": "missing",
          "confidence": "unknown",
          "evidenceType": "public_source_unknown",
          "notes": "Capability is absent from this normalized bag."
        },
        {
          "toolId": "mcp_unity_codergamester",
          "status": "implemented",
          "confidence": "medium",
          "evidenceType": "code_registry",